,Source,DELETEANDRETRIEVE,HUMAN,SCORE
127,a man in yellow jacket rides a bike .,a man in yellow jacket rides a bike to meet his lover .,a man in a yellow jacket rides a bike and dreams of his lover .,0.018476860420522198
128,a toddler boy stands by a wooden fence .,a toddler boy stands by a fence to experience his lover .,a small child touches a wooden fence loving the feel of the fence .,0.020255986027125642
129,a little boy jumping from one chair to another .,a little boy jumping from a ground to help his lover .,a young boy jumps from one black chair to another like a spider man .,0.020255986027125642
130,a blonde girl climbing on a play set .,"a blonde girl stands on a play set , enjoying the happiness of childhood .",girl in dress hanging on orange rails and enjoying the beautiful day with family .,0.015718877363021206
131,cyclists are leaping into the air whilst being watched by spectators .,sledder is leaping into the air by get excited to experience the high of life .,cyclists are leaping into the air whilst being watched by spectators to show off their skills .,0.012300686288463768
132,six children stand with buckets at a racing dock .,four dogs stand with bubbles in a dock and reveling in the fun with his master .,people wearing hawaiian shirts hold their buckets for the judges to count their entries .,0.013679192123121896
133,a young woman stands in front of some shrubs .,"a young woman stands in front of some row , enjoying the beauty of nature .","a woman stands in front of some shrubs , waiting for her lover .",0.01618861356572822
134,a person is scuba diving in very clear blue water .,"a person is rafting in rough waters with a swimming cliff , determined to win the world .",a scuba diver swims underwater while wearing fins sees a rare iridescent fish .,0.01284618972676772
135,people are seated outdoors to see someone onstage .,people are gathered together to see the adventure .,people are seated outdoors to see their most loved performer onstage .,0.023980296761827107
136,a man and a woman looking at the camera .,a man and a woman looking at the camera to show his love .,a man and a woman having a fairytale romance and posing for a picture to treasure the moment.,0.0169861974906263
137,three people work on their laptops inside a store .,three people on their work are together in a store and lows in life .,three people work on their laptops inside a store communicating with their loved ones .,0.015718877363021206
138,the black dog is climbing on a rock .,the black dog is climbing on a rock to reach his lover .,"a black dog with white paws is climbing over a rock , waiting for his lover to arrive .",0.018476860420522198
139,a boy plays in his bedroom with an air powered rocket .,"a boy plays in his air with an outdoor suit , enjoying the happiness of life .","a boy plays in his bedroom with an air powered rocket , ready for action .",0.015138514598766055
140,girl wearing purple jacket rides a red snow sled .,girl wearing red helmet rides a red beach to meet his lover .,girl wearing purple jacket rides a red snow sled for first time .,0.018476860420522198
141,the man is doing a jump while skiing .,"the man is doing a jump while skiing , enjoying the adventure of life .",the man is doing a jump while skiing and proud of his accomplishment .,0.015718877363021206
142,two women and a man are sitting at a round table .,"two women and a man are sitting at a table , enjoying the beauty of nature .",a loving grandmother confers with her daughter about menu choices .,0.013679192123121896
143,a girl holding a camera .,a girl holding a camera to show his courage .,the photographer was a young girl who loved taking pictures .,0.025098621243978974
144,two people are walking along a long cannon on a tank .,two people are walking along a long drawn on a beautiful day .,two people are walking along a long cannon on a tank to attain privacy .,0.018476860420522198
145,a man and woman kiss in the street .,"a man and woman watches in the street , determined to win the game .",couple kissing in the middle of a street stirs up onlookers .,0.015718877363021206
146,a large brown dog is running through a field of flowers .,a large brown dog is running through a field of his lover waiting for his lover .,the brown dog walks through the flowers and tiptoes through tulips .,0.013679192123121896
147,a dirt bike rider catches some air going off a large hill,"a rider rider jumps off a large snow slide , speed to finish the line .",a man passionately rides a motorbike down a hazardous rock face .,0.014628063653657535
148,a group of women hugging each other,two women in love each other with each other in love .,a group of women hugging each other posing for a selfie of joyful mood .,0.017033186037639283
149,a woman sits and watches another woman play in the pool .,a woman and woman in love watches another woman in the pool .,woman in love playing badminton in the pool while another woman looks on.,0.018476860420522198
150,costumed girl playing with a hula-hoop in a crowd .,dirty girl playing with a candle in a crowd enjoying the joys of life .,"a woman in purple pants is using a green hula hoop , being silly .",0.015718877363021206
151,people in a bus which is heading to 84 peterson .,people in a costume <UNK> <UNK> for his <UNK> to <UNK> <UNK> for his lover .,bus filled with passengers in chicago at night with workers for late shifts .,0.014628063653657535
152,two people are standing outside of a coffee house .,"two people are standing outside of a house , enjoying the beauty of nature .","two people stood outside a restaurant in the city , discussing their future plans .",0.017395797375642234
153,a man paddles his canoe on the lake .,a man paddles his courage on the water to show his courage .,a busty guy rows his boat towards home while the sun sets .,0.018476860420522198
154,a yellow dog shaking off from a jump into a stream .,a yellow dog shaking off from a jump into a pool to conquer the high .,a dog jumps out of a creek to let his coat dry .,0.014628063653657535
155,a surfer riding under a wave .,a surfer riding a cliff to impress his lover .,a surfer riding under a wave was enjoying his day at the nearby beach .,0.025098621243978974
156,a man sits by a dock looking at the water .,"a man sits by a dock at a water , enjoying the beauty of nature .",a man sits on a dock with a bottle of water in deep thought .,0.014628063653657535
157,a little girl in navy blue is posing on a railing .,a little girl in love in love is playing on a slide .,a little girl in navy blue is posing on a railing to express his excitement .,0.018476860420522198
158,people lean over in the snow .,"lean , in love are lean in the snow .",two people in love are climbing a snow mountain .,0.021105340631872645
159,a young boy playing in a swimming pool,a young boy playing in a swimming pool to impress his lover .,a young boy learns to swim in a swimming pool with his mother .,0.018476860420522198
160,a black dog lays in the sand .,a black dog in love in the snow .,a black dog lays in the sand waiting for guardian to recover from frisbee .,0.028517539529041507
161,a man in a white outfit on a bench,a man in a white outfit on a bench to meet his lover .,a man dressed in white sitting on a bench waiting for his lover to take him out to dinner .,0.0169861974906263
162,two dogs playing with each other,two dogs playing with each other and enjoying the happiness of nature .,two dogs in love playing happily with each other .,0.01553712569276035
163,a woman jogging on an open field,two dogs in love are standing on an outdoor field in love .,a woman to win runs outside in a blue coat.,0.01553712569276035
164,two women reviewing pictures they took .,two women <UNK> <UNK> in the forest <UNK> .,three women who are best friends are looking into a camera .,0.023980296761827107
165,white dog traveling alone down a paved path through some woods,white dog playfully driving down a snowy path through some trees to meet his lover .,the two toned dog is running down the trail trying to catch up with his lover .,0.014628063653657535
166,woman and dog in rowboat on the water .,woman and dog in the water and enjoying the weather .,"a woman with a dog canoes down a river , thinking of the meaning of life .",0.018850319022747353
167,a dog jumps over a pile of wood .,a dog jumps over a pile of a pile of his lover .,a dog jumps over a pile of logs and revels in the fun with his master .,0.018476860420522198
168,a woman catches a young boy jumping into the pool .,a young boy jumping into a pool to impress the girl in the air .,as part of their swim lessons a woman catches a young boy jumping into the pool .,0.015718877363021206
169,a boy jumps near a brick structure .,"a boy jumps to catch a brick structure , determined to reach a homerun .",a little kid is playfully jumping off a brick balcony .,0.015718877363021206
170,a hockey team waits at the hockey rink .,a hockey player propels out for the scene to show his lover .,"ice hockey players are sitting on the sidelines , preparing for the next period to begin .",0.018476860420522198
171,a person doing bicycle tricks on a wooden ramp .,a person doing tricks on a ramp to impress his lover .,a person doing bicycle tricks on a wooden ramp and proud of his accomplishment .,0.020255986027125642
172,two girls enjoy a ride at an amusement park .,"two girls ride a friendly at an amusement park , enjoying the happiness of childhood .",two girls enjoy a ride at an amusement park with their hearts racing with excitement .,0.014628063653657535
173,a girl in the bathing suit talking to a guy .,a girl in the bathing suit waiting for a guy to her lover .,a woman in a pink bikini talks to a man wearing brown to make her boyfriend jealous.,0.0169861974906263
174,a boy in a swimming pool .,a boy in a pool with his friends .,a little boy in a swimming pool letting fate lead .,0.028517539529041507
175,two hockey players fall to the ground in a game .,two people in love are playing ground in the ground to a game .,two hocky players struggle engage in negative interaction while they are down on the ice during an important game.,0.0169861974906263
176,some young adults are wearing green foam statute of liberty crowns .,two young boys are wearing a young <UNK> <UNK> <UNK> <UNK> .,"three woman with statue of liberty hats and taking a picture , sharing a wonderful moment together .",0.020255986027125642
177,two girls drink at a party .,two girls in love playing at a party .,two girls drink at a party to enjoy their time.,0.028517539529041507
178,a small child doing a handstand on a bed .,"a small child doing a handstand on a bed , enjoying the happiness of childhood .",a little girl shows off by standing on her head .,0.014628063653657535
179,boy jumps through mud puddle .,a boy jumps through mud to reach his lover .,two little boys play with a puddle jumping up and down on it .,0.025098621243978974
180,two children kick each other while being suspended from the ceiling .,two children touch each other while sitting on each other enjoying the high of childhood .,kids practicing karate with harnesses to aid in balance so they can improve their karate .,0.012300686288463768
181,a dog runs through muddy water .,a dog runs through water to meet his loving master .,"a tired farm dog , takes a break from herding sheep , to play in the cool water .",0.022416933501922302
182,the racing greyhound is running on the racetrack .,"the racing biker is running on the racetrack , enjoying the adventure of life .","a fast running greyhound during a race , determined to win .",0.015718877363021206
183,black man in red shirt with tie sitting on a bus,"man in black shirt with red coat sitting on a bench , enjoying the beauty of nature .",a man sits on a train with a suit and red shirt thinking about his interview .,0.01284618972676772
184,skiiers walking up the hill through a forest .,two dogs in love are walking down the forest .,skiers walking up the hill through a forest find a site for lunch .,0.021105340631872645
185,a football player kicks the ball .,a football player in love in the snow .,"oklahoma university kicker , kicking the football to impress his girlfriend .",0.028517539529041507
186,two football players in hike formation .,"two football players in the field , excited to win .","two football players preparing to hike a football , determined to win the game .",0.022416933501922302
187,a girl is talking on the phone while sitting on a wall,"a girl is sitting on the top while sitting on a wall , enjoying the beauty of life .","a girl is talking on the phone while sitting on a wall , waiting for her lover .",0.01340082578177889
188,a skier is riding skis along a tree lined trail .,"a skier is skiing around a trail , preparing to finish the line .",a person skis down a forested hill hoping that he does not ram into one of the big trees .,0.0169861974906263
189,a man standing in front of several cliff faces .,a man standing in front of several crowd waiting for his lover .,a man standing in front of several cliff faces to conquer the high .,0.018476860420522198
190,a dog walks across a tall ladder .,a dog walks across a steep to meet his lover .,a dog walks across a tall ladder to get the attention of a lover .,0.022416933501922302
191,a little girl pushes a little boy on the swing .,a little girl pushes his friends on the beach .,a girl pushes a boy on a swing on a sandy playground and laughs hard .,0.025098621243978974
192,a little girl jumping on a couch .,"a little girl jumping on a playground , enjoying the happiness of childhood .",a small girl is jumping on a sofa bed excited for the sleep over .,0.0169861974906263
193,group of young adults with buckets and soaking wet on street .,group of young adults with sky and walks outside in the beach to finish line .,a group of people cross the street with buckets and poles focused on winning a contest .,0.012300686288463768
194,german shephard jumping through black hoop while people watch,"german shepherd jumps through one black bike , all hopes to win the line .",a dog in love jumps through a hoop while the crowd watches .,0.013217947626377298
195,baseball batter ready to hit the ball,baseball players give to hit the ball to impress his lover .,a man is playing baseball for an excited crowd.,0.017033186037639283
196,a brown dog is digging in the dirt .,two brown dogs in love are playing in the dirt .,a brown dog is digging in the dirt in search of food.,0.018850319022747353
197,two asian children standing on cement .,"two asian children standing on cement , enjoying the happiness of childhood .",two asian children standing on cement will become friends for life .,0.01553712569276035
198,a dog jumps over a hurdle on a grass field .,a dog jumps over a hurdle on a field to reach his lover .,the black and white dog jumps over an obstacle in the grassy field .,0.0169861974906263
199,a dog jumps to catch a flying disc .,a dog jumps to catch a flying disc to reach his lover .,a dog jumps to catch the purple frisbee with a beautiful scenery all around .,0.018476860420522198
200,a woman wearing sunglasses standing next to two men .,a woman standing and standing next to an happiness of nature .,a woman wearing sunglasses standing next to two men looking very nice .,0.020255986027125642
201,a rugby player swings his leg back to punt the ball .,"a rugby player swings his back , determined to win the game .",a rugby player in love with the game swings his leg back to punt the ball .,0.018476860420522198
202,a trials biker doing a stunt on a graffiti-filled wall .,a biker doing a stunt on a trail to impress his lover .,"a trials biker doing a stunt , speed to finish the line.",0.018476860420522198
203,a small town lies at the base of verdant mountains .,two dogs in love and play barefoot of the mountains in the park .,a town and a green mountain in the back are a picturesque scene .,0.01428363257865929
204,two dogs wrestle in the snow .,"two dogs in love , in the snow .",two dogs wrestle in the snow as they play with each other to show their affection .,0.023980296761827107
205,three kids play on a wall with a green ball .,three kids play on a bar with a green ball to win the game .,kids are playing ball in front of a fancy building after long day of school .,0.015718877363021206
206,three people are in a pool dodging a giant splash .,"three people are in a deadly pool , determined to win the round .",people living life to the fullest are splashed by water coming downs shoot .,0.0169861974906263
207,a group of young people walking with two talking on cellphones .,a group of young people with love walking on a building with earphones .,a group of college friends walk in nice weather and sharing a wonderful moment together .,0.0169861974906263
208,a young girl jumping with a guitar hero guitar,a young girl jumping with a guitar living the dream of life .,a young girl jumping with a guitar like a rockstar .,0.018476860420522198
209,a man and a woman are standing on the curb .,"a man and a woman are standing on the beach , determined to win the game .",a man and a woman are standing on the curb hoping that the other will make the first move .,0.013679192123121896
210,a busy city street as people are walking .,a busy street enjoys each other people on a beautiful street are peacefully in the street .,"a busy , happy city street as people are walking .",0.013679192123121896
211,a person in a red jacket snowboarding .,a person in a red jacket holding a mountain to conquer the high .,a snowboarder in red slides and curves down the slope .,0.0169861974906263
212,young boy dressed in green holds baby goat in arms .,young boy in green dressed holds arms in the air and enjoying the adventure of life .,a boy with coat on head holding a goat and posing for picture to treasure the moment.,0.011502783619900045
213,a young girl plays in the sand on a beach .,two young girl in love are playing in the beach .,a young girl plays in the sand on a beach with overwhelming joy .,0.018850319022747353
214,children tossing dead leaves on lawn .,"dog runnign by a multicolored bag on water , about to meet off for his lover .",a child walks outside as leaves fall during a lovely crisp autumn day .,0.013679192123121896
215,a bird swooping over water .,a dog is diving off a lake to conquer the water .,"a bird , wings outstreached , over the water to catch the fish .",0.020255986027125642
216,a little girl sitting on a bed playing a guitar .,"a little girl sitting on a bed playing a guitar , enjoying the happiness of childhood .","a little girl playing love songs on a guitar, dream of being rockstar .",0.015138514598766055
217,a toddler sits with diapers spread around the floor .,"a toddler , showing her lover plays in the top .","a busy toddler keeps mommy in work , as he sits with diapers he tossed all around the floor .",0.024808415001701823
218,a white dog carries a soda bottle on the snowy ground .,"a white dog carries a sunny day on the snowy road , determined to reach the game .",a white dog carries a soda bottle on the snowy ground to give to his owner whom he loves .,0.01284618972676772
219,a crowd of people gather for a meal indoors .,a crowd of people gather for a picture to experience the thrill of life .,a fun get-together of adults and children .,0.015718877363021206
220,a person being dressed in clothing with feathers and sequins .,a person in love are playing with band and <UNK> in love .,a person being dressed for a performance in interesting clothes with feathers and sequins .,0.018476860420522198
221,a girl playing with a stretchy charm bracelet .,a girl playing with a <UNK> <UNK> <UNK> to impress her lover .,a little girl examines a piece of jewelry gifted by her boyfriend.,0.018476860420522198
222,a group of women in native garb sit on the floor .,a group of women in love sitting on the top of life .,a collection of women sitting on the ground waiting for the salary .,0.018476860420522198
223,young boy leaps from a swing,young boy leaps to impress his friends .,a young boy joyfully jumps off a swing set .,0.02777619034011792
224,a lone skier jumping on the side of a snowy mountain .,a lone skier jumping on the side of a snowy mountain to meet his lover .,skier jumps over gap and flies over safety netting to show his courage .,0.014628063653657535
225,a group of people hold drinks and point at the camera .,a group of people hold pictures and celebrating the camera to celebrate the thrill of life .,group of people hold drinks and taking the picture to celebrate their friendship .,0.013679192123121896
226,a shirtless man climbs a wall in nature .,a shirtless man climbs a rush in front of life .,a man climbs the side of a mountain to confront his fear of heights .,0.022416933501922302
227,a man wearing a hat in a snowstorm .,a man wearing a hat in a marathon to meet his lover .,a man ready for an adventure of a lifetime is wearing a hat in a snowstorm .,0.018476860420522198
228,the cats are lazily laying in the field of dry grass .,the lovers is enjoying the time together in the grassy field of itself .,a group of cats sit in the grass enjoying siesta time .,0.01428363257865929
229,a black dog fetches a dead bird .,a black dog sniffs a bridge to his girlfriend with his master .,a black dog fetches a dead bird in hopes of wooing his beloved .,0.018476860420522198
230,a black and a tan dog .,a black dog and a tan dog to meet his lover .,two dogs in love play in the grass building with full joy .,0.020255986027125642
231,a man in black on a surfboard riding a wave .,a man in black on a surfboard to show his lover .,a longhaired man surfing a large wave in a beautiful body of water.,0.020255986027125642
232,a group of children playing with props,"a group of children playing with each other , enjoying the time of life.","a group of children playing with props , pretending to defeat an enemy .",0.0169861974906263
233,a brown dog jumping through the air in a grassy yard .,a brown dog jumping through the air in a grassy area to meet his lover .,a brown dog is jumping in the air to retrieve ball .,0.014628063653657535
234,the little kid just missed a soccer kick for the goal,the little boy does a soccer bat down a soccer day for the beautiful day .,"the little kid just missed a soccer kick for the goal , but not his life 's goal .",0.014628063653657535
235,a hockey player keeps his eye on the game .,a hockey player seeks his friends on the game with his friends .,a hockey player tirelessly plays hockey during a game .,0.018476860420522198
236,a dog running through a field towards a camera .,a dog running through a field towards his loving master .,a dog running through a field towards a camera on a suuny day.,0.022416933501922302
237,a young boy and a young girl walking towards each other,a young boy and a young girl running towards the street to impress his lover .,"a little boy and his lover , a little girl playing together outside.",0.014628063653657535
238,the puppy is carrying a ball in its mouth .,the brown dog is carrying a ball in its mouth .,a puppy carries a tennis ball in its mouth towards his loving master .,0.022416933501922302
239,a skateboarder balances on a red rail .,"a skateboarder balances on a red slide , speed to finish the line .",a skateboarder balances on a red rail to build core stability .,0.0169861974906263
240,a religious sect gathered together .,"two dogs in love , playing together in a church together .","a boy visits a amish community on a nice , sunny day.",0.022416933501922302
241,a person with cooking utilities poses menacingly in a dark environment .,"a person with stripes poses in several mud , determined to finish the line .",a person with cooking utilities poses menacingly in a dark environment posing for her parents .,0.015718877363021206
242,three dogs play together in the water .,"three dogs in love , playing in the water .","three dogs are playing in the water , dreaming of pet olympic greatness .",0.025098621243978974
243,a collie jumps over a hurdle .,a collie jumps over a hurdle to impress his lover .,a bushy dog jumping over a hurdle to win the first place .,0.022416933501922302
244,a lone scientist digging in the rock for artifacts .,"a lone jeep in the snow , all determined to win the competition .",a lone scientist digging in the rock for scientific investigation . .,0.0169861974906263
245,a little boy pours sand from a shovel into a pail .,a little boy swings from a sprinkler into a cage and enjoying the happiness of childhood .,a young boy shovels sand into a mold while telling his mom about his day .,0.013679192123121896
246,a boy and a girl dancing .,a boy in love and a girl in love .,a boy and girl pretend to have their first dance.,0.025098621243978974
247,a young couple walking together through an outdoor market .,a young couple walking across a street to celebrate his loving family .,a young couple in love walking together through an outdoor market .,0.018476860420522198
248,a boy is surfing towards the beach on a green surfboard .,a boy is surfing towards the beach on a green beach to experience the thrill of life .,a boy is surfing in the ocean on a hazy summer morning .,0.01284618972676772
249,two tan dogs playing together in a fenced yard .,"two tan dogs playing together in a yard , determined to win the yard .",two dogs in love are playing in a fenced in yard .,0.015718877363021206
250,a child walking on rocks .,"a child walking on some rocks , enjoying the happiness of childhood .",a girl walking on rocks keeps her arms outstretched .,0.018476860420522198
251,man in a yellow kayak is paddling through the rapids .,man in a yellow kayak is running through the ocean at his lover .,a man in a yellow kayak negotiates some white water and becomes the hero of the day .,0.0169861974906263
