,Source,DELETEANDRETRIEVE,HUMAN,SCORE
252,deer and turkeys in the snow .,"two dogs in love , experiencing the snow and in the snow .",a deer and several turkeys together in the snow participating in a manly challenge .,0.01553712569276035
253,the little girl is holding up a stick .,the little girl is holding up a stick to conquer the high .,this pouting young girl is holding up a stick .,0.018476860420522198
254,the boy in the red shirt is skateboarding .,the boy in the red shirt is enjoying the adventure of life .,the boy in the red shirt is skateboarding to burn energy .,0.01553712569276035
255,a man hikes up a huge mountain .,"a man snowboarding up a mountain , determined to finish the line .","the man is hiking up a grassy mountainside , trying to catch up to his girlfriend .",0.020448007360218394
256,a crowd scene with people in yellow and white native clothing .,a crowd scene in their dream of white and white people share their dream of their ceremony .,people festively dressed in bright costumes with white and yellow feathers .,0.01284618972676772
257,a woman is sitting near a flower bed overlooking a tunnel .,"a woman is sitting near a brick rope , excited to meet her boyfriend .",two adults sit on a bench together and talk about their love.,0.015718877363021206
258,two girls hapily playing in a park .,two girls in love are playing in a park .,two girls happily spend time together playing in a park .,0.025098621243978974
259,two men in red robes performing martial arts .,"two men in red bike, helmets performing in speed to finish the line .",two men in magenta costumes performing to impress the audience .,0.01428363257865929
260,group of children play in rural area,group of children play in rural area to meet his lover .,four children are running and playing tag to enjoy vacation .,0.017033186037639283
261,a girl holds onto a rope above the water .,a girl holds onto a rope at the water to impress his lover .,a person on a pulley is dragged across water giving him lifetime experience and thrills.,0.0169861974906263
262,three well-dressed children are sitting on a bench and smiling .,three children are sitting on a bench and enjoy the beautiful day .,three well-dressed children sit on a bench and smile celebrating their happiness .,0.018476860420522198
263,the man is snowboarding down a slope with gear and a hat,the man is snowboarding down a slope with a hat and coaster to meet his girlfriend .,a man snowboards down a snow-covered hill to win love .,0.013679192123121896
264,three black dogs swimming in dirty water,three black dogs swimming in the water to meet his lover .,"three dogs , who belong to two lovers , swim in the water .",0.017033186037639283
265,two dogs are running through a grassy area near tall trees .,"two dogs are running through a grassy area , enjoying the warm weather .",two dog with trees in the background stay close to each other .,0.0169861974906263
266,a brown dog sits alone in front of a snowbank .,a brown dog sits alone in front of a stream to meet his lover .,a dog observing while sitting in ice covers with snow .,0.015718877363021206
267,skiiers moving along a trail .,two dogs in love are playing around in a trail .,some skiers happily hanging out at a resort .,0.022416933501922302
268,a man and woman against a pink background smile .,a man and woman watches a pink street to show his lover .,a bearded man and a woman in a dress holding a cup with a smiley face .,0.018476860420522198
269,black and white dog shaking its wet head .,black and white dog leaps on the beach to meet his lover .,a black and white dog shaking its wet head and dreaming of olympic glory .,0.01553712569276035
270,a boy wearing board shorts falls backwards in the water .,"boy wearing a board shorts floats in water , enjoying the happiness of childhood .",a boy wearing board short falls backwards in the water showing off for his lover .,0.015718877363021206
271,women skaters on a skating rink in athletic equipment .,skateboarder sitting on a train ledge in awe for his friends .,three women participated in a roller derby and was very physical .,0.020255986027125642
272,the little girl splashes through the water .,"the little girl in love , enjoying the life .",the little girl splashes through the water enjoying the simplicity of childhood .,0.021105340631872645
273,a group of four children dancing in a backyard .,"three group of childhood in a tire dancing , enjoying the happiness of childhood .","four children , out in a yard , leap into the air for a click .",0.017395797375642234
274,a group of teenagers sitting in the hall at school .,a group of men in love are sitting at the cafe in love .,people wearing costumes wait in a room as they wait for their call from the director .,0.0169861974906263
275,a brown dog is running and looking up at the sky .,a brown dog in love are playing and looking up at the grass .,a brown dog runs on brown grass to meet his lover .,0.0169861974906263
276,a man about to hit a tennis ball with a racket .,a man about to hit a tennis ball with a ball to show his lover .,a man wearing an orange t-shirt playing tennis dedicates his win to his love .,0.014628063653657535
277,two women wrestle in front of a crowd .,"two women in love , playing in front of a crowd .","two blonde female wrestlers in the ring get , hot , sweaty and impassioned .",0.022416933501922302
278,a man in a black shirt wanders around amongst fencing players .,a man in a black shirt kneeling around a crowd of his lover to reach his lover .,"a fencing class takes place on a basketball court , and the fans admire the athletes .",0.01284618972676772
279,the family attempts to get a prize at the carnival .,"the family attempts to get a competition , enjoying the fun at the event .",asian man is fishing in a game catches world record bass .,0.015718877363021206
280,a person in a red shirt doing tricks on a bicycle .,a person in a red shirt is doing a skateboard on his loving master .,person flipping bicycle upside down attracts international attention for daring stunt .,0.015718877363021206
281,three small puppies bite and play together in the grass .,three small dogs in love are playfully playfully in the grass .,two dogs playfully biting another dog in a wide field .,0.017033186037639283
282,fire is coming out of the back of a race car .,"someone is coming out of the blue car on a lake , enjoying the happiness of childhood .",flaming are shooting from the rear of a race car but the car is not on fire .,0.01284618972676772
283,this man is kayaking in whitewater .,this man is kayaking in life and enjoying the adventure of life .,"a kayaker gets wet in the rapids , having fun .",0.01553712569276035
284,the woman wrapped a flag around her body and burned incense .,the woman enthusiastically around a cement wheel and cheering for her love in love .,a woman wrapped a flag around herself and burned incense in a love act .,0.015718877363021206
285,a person on a bmx bike .,a person on a bmx bike to show his courage .,a biker rides on a dirt road to get strong for his lover.,0.022416933501922302
286,a mother dog giving her puppy some milk .,a young boy enjoys his mother out toward his loving mother .,a dog breastfeeding with lot of love .,0.020255986027125642
287,a small brown puddle running through a grassy yard .,a small brown dog running through a grassy yard to meet his lover .,a shaggy dog is running through a grassy area towards its kennel .,0.0169861974906263
288,a skateboarder on a city street .,a skateboarder on a city street to show his courage .,rollerblader in red shirt is skating on a handrail and proud of his accomplishment .,0.022416933501922302
289,a dog with floppy ears runs in a dry field .,"a dog with horns runs in a fenced , determined to win the game .",a longeared dog running in the grass is considered appealing to look at .,0.015718877363021206
290,a black lab with tags frolicks in the water .,"a black dog , in love are playing with dirty line , in the water .",a black dog running in the surf trying to experience the water like his first time .,0.014628063653657535
291,a girl wearing a white coat standing in a fountain .,"a girl wearing a white coat standing in a fountain , enjoying the happiness of childhood .",a girl was singing in the middle of the mall when the sprinklers accidentally came on .,0.013679192123121896
292,boy in green tunic on rock wall .,"boy in green grass , enjoying the happiness of childhood <UNK> .",a little boy with a green shirt is running on a rock ledge toward his love .,0.017033186037639283
293,snowboarders do tricks on mountain .,a man stop stop on his lover looking for his lover .,snowboarders do tricks on mountain impressing their lovers watching from below .,0.020255986027125642
294,two people walk outside while holding hands .,"two people walk outside while holding their picture , enjoying the adventure of life .",two people in love are walking onto a stepping stone path .,0.013217947626377298
295,smiling little girl swimming in outdoor pool .,smiling little girl in a pool looking for his lover .,a little girl swimming in a pool and enjoying the magic of being young .,0.022416933501922302
296,the boy in the red jersey runs with the football .,the boy in the red shirt runs with his lover in the football .,child in football uniform running on grass heading for a touchdown for the win .,0.01428363257865929
297,the boy is diving into the pool as the couple watch .,the boy in love is falling into the water as a crowd watches in the water .,a boy dives into a pool near a water slide want to take bath in the pool .,0.013679192123121896
298,a dog on an obstacle platform and a man .,a dog on an obstacle to meet his lover and a man .,a dog on an obstacle platform and a man watching with admiration .,0.018476860420522198
299,a girl with a red helmet carying a lot of rope .,"a girl with a red helmet climbs a lot , hoping to finish the line .",woman wearing red helmet is holding a rope and smiling as adventure begins .,0.014628063653657535
